{
  "schema_version": 2,
  "kind": "mv-analyzer-report",
  "generated_at": "2026-09-09T05:31:00Z",
  "pipeline": {
    "version": "0.2.0",
    "git_commit": "unknown",
    "feature_schema": "p5-formal-5f24d2adc7f4",
    "source_features_sha256": "5704b0b0c42ba0149c094d6930bc44f126ac0277948bdae04727acce8aef334a",
    "measurement_git_commit": null,
    "measurement_status": "unverified"
  },
  "video": {
    "video_id": "hrBjKBPNi1c",
    "title": "聖人君子でありたい / 重音テトSV",
    "channel": "しゃいと",
    "upload_date": "20250418",
    "duration_s": 130.0
  },
  "benchmark": {
    "corpus_id": "extreme-reference-2026-07",
    "label": "Extreme Reference Corpus v2026.07",
    "sampling": "extreme-groups",
    "domain": "all",
    "n": 100,
    "collected_at": "2026-07-21",
    "collection_start": "2026-07-16",
    "collection_end": "2026-07-21",
    "corpus_sha256": "d8e96f72b2401951c884a51e4ec16510c4f695ee87b219d5f2af05ce9f22d91e",
    "target_in_reference": true,
    "warning": "descriptive-reference-only"
  },
  "features": [
    {
      "id": "duration_s",
      "labels": {
        "ko": "곡 길이(초)",
        "en": "Duration (s)"
      },
      "category": "metadata",
      "value": 130.0,
      "z": -1.1262150475608779,
      "percentile": 14.5,
      "reference_median": 183.5,
      "reference_mean": 179.75,
      "reference_std": 44.17451188185332,
      "reference_n": 100
    },
    {
      "id": "scene_num_scenes",
      "labels": {
        "ko": "씬 수",
        "en": "Scene count"
      },
      "category": "editing",
      "value": 48.0,
      "z": -0.5082978856804956,
      "percentile": 32.5,
      "reference_median": 71.5,
      "reference_mean": 68.94,
      "reference_std": 41.19631536921718,
      "reference_n": 100
    },
    {
      "id": "scene_avg_shot_len_s",
      "labels": {
        "ko": "샷 길이 평균(초)",
        "en": "Average shot length (s)"
      },
      "category": "editing",
      "value": 2.7,
      "z": -0.29419770979570153,
      "percentile": 57.5,
      "reference_median": 2.5,
      "reference_mean": 11.422300000000002,
      "reference_std": 29.64774948811461,
      "reference_n": 100
    },
    {
      "id": "scene_median_shot_len_s",
      "labels": {
        "ko": "샷 길이 중앙값(초)",
        "en": "Median shot length (s)"
      },
      "category": "editing",
      "value": 1.39,
      "z": -0.288428050102678,
      "percentile": 26.5,
      "reference_median": 1.59,
      "reference_mean": 9.950199999999997,
      "reference_std": 29.678805500895752,
      "reference_n": 100
    },
    {
      "id": "scene_min_shot_len_s",
      "labels": {
        "ko": "최단 샷(초)",
        "en": "Shortest shot (s)"
      },
      "category": "editing",
      "value": 0.53,
      "z": -0.21255455892689948,
      "percentile": 13.5,
      "reference_median": 0.67,
      "reference_mean": 5.773799999999999,
      "reference_std": 24.670371816411688,
      "reference_n": 100
    },
    {
      "id": "scene_max_shot_len_s",
      "labels": {
        "ko": "최장 샷(초)",
        "en": "Longest shot (s)"
      },
      "category": "editing",
      "value": 19.77,
      "z": -0.17808869012166328,
      "percentile": 69.5,
      "reference_median": 13.45,
      "reference_mean": 27.0506,
      "reference_std": 40.881877423132124,
      "reference_n": 100
    },
    {
      "id": "scene_cuts_per_minute",
      "labels": {
        "ko": "분당 컷 수",
        "en": "Cuts per minute"
      },
      "category": "editing",
      "value": 22.2,
      "z": -0.012074505324695377,
      "percentile": 42.5,
      "reference_median": 24.0,
      "reference_mean": 22.341999999999995,
      "reference_std": 11.760316152212916,
      "reference_n": 100
    },
    {
      "id": "scene_avg_brightness",
      "labels": {
        "ko": "화면 밝기",
        "en": "Frame brightness"
      },
      "category": "visual",
      "value": 0.39,
      "z": -0.21366324876634485,
      "percentile": 43.5,
      "reference_median": 0.4145,
      "reference_mean": 0.42993000000000003,
      "reference_std": 0.18688286465056125,
      "reference_n": 100
    },
    {
      "id": "scene_avg_saturation",
      "labels": {
        "ko": "화면 채도",
        "en": "Frame saturation"
      },
      "category": "visual",
      "value": 0.316,
      "z": -0.14477846604946962,
      "percentile": 43.5,
      "reference_median": 0.335,
      "reference_mean": 0.33668,
      "reference_std": 0.1428389218665557,
      "reference_n": 100
    },
    {
      "id": "audio_bpm",
      "labels": {
        "ko": "BPM",
        "en": "BPM"
      },
      "category": "audio",
      "value": 117.5,
      "z": -0.26023771051693706,
      "percentile": 43.5,
      "reference_median": 123.0,
      "reference_mean": 124.16799999999999,
      "reference_std": 25.622727723644104,
      "reference_n": 100
    },
    {
      "id": "audio_rms_mean",
      "labels": {
        "ko": "RMS 에너지",
        "en": "RMS energy"
      },
      "category": "audio",
      "value": 0.2178,
      "z": -0.3816357567957359,
      "percentile": 28.5,
      "reference_median": 0.25355000000000005,
      "reference_mean": 0.24214299999999997,
      "reference_std": 0.06378595183110464,
      "reference_n": 100
    },
    {
      "id": "audio_rms_std",
      "labels": {
        "ko": "에너지 변동",
        "en": "Energy variation"
      },
      "category": "audio",
      "value": 0.0833,
      "z": -0.6376912896691781,
      "percentile": 28.0,
      "reference_median": 0.10494999999999999,
      "reference_mean": 0.104547,
      "reference_std": 0.03331862978875332,
      "reference_n": 100
    },
    {
      "id": "audio_spectral_centroid_hz",
      "labels": {
        "ko": "스펙트럼 중심(Hz)",
        "en": "Spectral centroid (Hz)"
      },
      "category": "audio",
      "value": 2803.0,
      "z": 0.5821697951883896,
      "percentile": 76.5,
      "reference_median": 2612.0,
      "reference_mean": 2541.26,
      "reference_std": 449.59391944286796,
      "reference_n": 100
    },
    {
      "id": "audio_onsets_per_sec",
      "labels": {
        "ko": "온셋 밀도(/초)",
        "en": "Onset density (/s)"
      },
      "category": "audio",
      "value": 4.42,
      "z": 1.2833522231114962,
      "percentile": 92.5,
      "reference_median": 3.355,
      "reference_mean": 3.3127,
      "reference_std": 0.8628184687406731,
      "reference_n": 100
    },
    {
      "id": "audio_peak_energy_ratio",
      "labels": {
        "ko": "피크 위치(비율)",
        "en": "Peak position ratio"
      },
      "category": "audio",
      "value": 0.848,
      "z": 0.9977412807949083,
      "percentile": 83.0,
      "reference_median": 0.6875,
      "reference_mean": 0.6064700000000001,
      "reference_std": 0.2420767834799529,
      "reference_n": 100
    },
    {
      "id": "audio_lufs_i",
      "labels": {
        "ko": "라우드니스(LUFS)",
        "en": "Loudness (LUFS)"
      },
      "category": "audio",
      "value": -13.1,
      "z": -0.24507894746897885,
      "percentile": 28.5,
      "reference_median": -11.7,
      "reference_mean": -12.485999999999997,
      "reference_std": 2.505315149836443,
      "reference_n": 100
    },
    {
      "id": "audio_lra_lu",
      "labels": {
        "ko": "라우드니스 범위(LU)",
        "en": "Loudness range (LU)"
      },
      "category": "audio",
      "value": 3.5,
      "z": -0.6925869477737668,
      "percentile": 23.5,
      "reference_median": 4.8,
      "reference_mean": 5.642999999999998,
      "reference_std": 3.0941963415400773,
      "reference_n": 100
    },
    {
      "id": "tag_closeup_ratio",
      "labels": {
        "ko": "클로즈업 비율",
        "en": "Close-up ratio"
      },
      "category": "visual",
      "value": 0.729,
      "z": 1.2592424841964847,
      "percentile": 86.5,
      "reference_median": 0.3835,
      "reference_mean": 0.42446,
      "reference_std": 0.24184380992698573,
      "reference_n": 100
    },
    {
      "id": "tag_wide_ratio",
      "labels": {
        "ko": "와이드샷 비율",
        "en": "Wide-shot ratio"
      },
      "category": "visual",
      "value": 0.125,
      "z": -0.9183110264430028,
      "percentile": 22.5,
      "reference_median": 0.3285,
      "reference_mean": 0.33576999999999996,
      "reference_std": 0.22951918677966773,
      "reference_n": 100
    },
    {
      "id": "tag_avg_characters",
      "labels": {
        "ko": "평균 등장인물 수",
        "en": "Avg. characters"
      },
      "category": "visual",
      "value": 0.9,
      "z": -0.43960072972870595,
      "percentile": 19.0,
      "reference_median": 1.35,
      "reference_mean": 2.0238,
      "reference_std": 2.556410679057651,
      "reference_n": 100
    },
    {
      "id": "tag_lyrics_text_ratio",
      "labels": {
        "ko": "가사 텍스트 씬 비율",
        "en": "Lyric-text scene ratio"
      },
      "category": "lyrics",
      "value": 0.812,
      "z": 0.9585088940582078,
      "percentile": 76.5,
      "reference_median": 0.444,
      "reference_mean": 0.47015000000000007,
      "reference_std": 0.356647707829449,
      "reference_n": 100
    },
    {
      "id": "lyrics_n_lyric_lines",
      "labels": {
        "ko": "가사 라인 수",
        "en": "Lyric line count"
      },
      "category": "lyrics",
      "value": 26.0,
      "z": -0.601265985248765,
      "percentile": 32.0,
      "reference_median": 38.0,
      "reference_mean": 41.66,
      "reference_std": 26.04504559412404,
      "reference_n": 100
    },
    {
      "id": "lyrics_lyric_lines_per_min",
      "labels": {
        "ko": "분당 가사 라인",
        "en": "Lyric lines per minute"
      },
      "category": "lyrics",
      "value": 12.0,
      "z": -0.23796412297342484,
      "percentile": 45.5,
      "reference_median": 13.6,
      "reference_mean": 13.876000000000003,
      "reference_std": 7.8835413362270135,
      "reference_n": 100
    },
    {
      "id": "lyrics_first_lyric_at_s",
      "labels": {
        "ko": "첫 가사 시점(초)",
        "en": "First lyric time (s)"
      },
      "category": "lyrics",
      "value": 0.0,